reviews.text,cluster_label
Amazon is great tablet and the price is excellent great,
User friendly and overall great product Camera quality is not the greatest but this is not intended to be used as a camera so I cant complain,
Love this tablet easy to use and extremely affordable,
Bought as a reading tool for my daughter She enjoys it and also the fact that she can download apps Great tool for school and fun,
Bought for husband to replace his old one Uses it all the time and would recommend,Smart Speakers
daughter loves it uses it every day likes everything about it,Smart Speakers
My youngest daughter is very pleased with this tablet,
Easy to use Perfect for using for my clinicals in nursing school,Smart Speakers
Easy to use and the HD is awesome The simplicity as well as the easy to follow directions to set it up is great It does everything I want it to do,
Great products as usual and great customer service,
It helps if your an amazon prime member  You can download a lot more things to do on the tablet,
This was purchased as a gift for an avid reader and as a streaming media device I looked at the bigger kindle but this one is the right compromise between size and portability for the planned uses,Smart Speakers
A great alternative to the more expensive tablets Battery lasts for quite a while,
Love love love my kindle fire Had the original and then bought and iPad then bought this kindle and I am wondering why I even bought the iPad Will not switch again I will stick with my kindle,Smart Speakers
The fire runs well and was easy to set up The pop up adds are a bit annoying but the tablet works well,
Happy with the purcase Gift for my mother in law,Smart Speakers
ok i did like the product very much thank you for ok,Smart Speakers
Great for reading books Does everything an iPad or tablet does,E-Book Readers
It is a lot cheaper than other tablets with all the functions I need,Smart Speakers
This is a excellent tablet for browsing the internet and reading ebooks and for the price you cant beat it,
My ND would way rather have a fire any day than an ipad,Smart Speakers
Loved the product First I was disappointed that I could not download Google Store apps but a Quick Google Search fixed that Issue and now I can download any Google Store Apps The Battery Life is amazing as I was able to Watch around  Full Movies on a Single Charge Performance is great as Games like Marvel Champions Modern Strike Online had no issues Able to add an SD Card is just perfect as I dont have to worry about Storage for downloading Movies or Apps Speakers are better then my Samsung Galaxy S For the Price point of this Tablet there is not a single thing to Complain If I have to Brightness of the Screen can be better,
the amount i paid for the tablet is worth it on sale,
My grandson loves it  He was very happy with it ,Smart Speakers
This tablet works well for surfing the internet and playing music,
My husband and I have totally enjoyed owning these Amazon Fire tablets They are so much easier on the eyes than our iphones,Smart Speakers
Great improvement over the old kindle fire Better size than the hd Not to big and not too small Fast processing spead,
My wife loves it Great picture quality and easy to use,
Got this for my  year old son Great for reading books and playing games Cant beat the price,
Bought for my wife she loves it took some getting use to though but she is doing well with it,Smart Speakers
Bought as a gift for my mother Instead of her feeling locked at the computer she can now access the web from anywhere in the house,Smart Speakers
This is just the perfect item for what we needed It is compact and can go anywhere with you,Smart Speakers
She says this was the best gift she ever received,Smart Speakers
My kids got this to replace their Ipads and havent missed a beat,Smart Speakers
Bought this for my aunt for Christmas She had wanted a book reader But then she decided she wanted something she could play games on Shes very happy with it,Smart Speakers
Purchased as a replacement for an older kindle and the fire HD did not disappoint The intended recipient was thrilled that a camera came with it Well worth the money,Smart Speakers
th amazon product I own it is a great budget tablet,E-Book Readers
Bought for the daughter for Christmas and seems to work great,
For the price this tablet is an absolute steal Ive never had an iPad to compare it to but thats only because Ive never wanted to spend hundreds of dollars for a tablet,
Recently upgraded from the inch kindle and i must say huge improvements all i can say is that if they can speed up the processor by next year with more ram they might compete with the ipad,Smart Speakers
The tablet was a good gift for Christmas I bought it on black Friday for a cheap price,
I put a memory card in this and put the Play Store on it Google it I use it as a mini office with a Bluetooth keyboard I love it,Smart Speakers
This  tablet is much better than the older  tablet It is faster and have a camera Great improvement over the older version,
Great size Works with all apps No issues yet Would buy more,
Gifts for  yr old grandsons very easy for them to maneuver around great charge life We have to forcethem to take breaks,
This is the perfect tablet for basic use or if upgrading from the kids edition of the Amazon Fire Much less expensive than an iPad and more durable if you have a tween who isnt always careful with their tech,
This was the first time I had a tablet It is so much fun to play games on,
Prefer no amps on unit and just allow buyer to place the amps they want or will ever use,Smart Speakers
This is perfect for kids The parental controls make me feel secure in letting my child use the tablet safely,
I would recommend this to other grandparents for their grandkids,Smart Speakers
this works great if you use amazon a lot and watch movies from amazon,
Great product for surfing the internet or reading books,
I am familiarizing my self with no conclusion to say something about it now,Smart Speakers
I was expecting an Android device and discovered it was an Android like device My fault for not reading up on his device before hand I returned the Amazon Fire and bought a Samsung Tab EI probably would recommend this tablet if you wanted a device for reading,
Bought this as a gift for my aunt and she loves it Easy to get connected and set up She is totally nontechny and was able to do it herself Great buy,
I love this Kindle and bought it for the upgrades to replace my original kindle fire I would give it an excellent rating if the camera were better but the pictures come out grainy and not very clear Great for watching shows and videos and these are very clear Love playing games on it and of course reading the latest books,
Was looking for an inexpensive tablet for our child Got this while on sale and ordered a screen protector and child case Has worked well Can set daily limits to prevent them from using to much Would buy again,
Bought it on sale for Christmas gift and well worth the money Does everything needed with good functionality Easy to use for those not too tech savvy,Smart Speakers
Bought this as a gift  they seemed to like it The price was nice and so was the size of it,
This is a great device I needed something small to read books on This device is exactly what I was looking for,
Purchase this tablet during the Christmas holidays on sale Got as a gift for my jobs Christmas gift party The person who got it was very happy with it I am familiar with the tablet because I bought one for my wife when they first came out for her to use to read her books,
My nephew likes the large size of the Fire tablet as its significantly larger than his phone,
This is a great little tablet especially for the price,E-Book Readers
Nice deals on the product with saving and good customet experience,Smart Speakers
I bought the Kindle Fire HD as a Christmas gift for my mom She has never had a computer or Kindle She loves it Best gift I gave her She plays a lot of games on it That keeps her mind working Love the size of screen,Smart Speakers
Purchased for my nephew for Christmas He loved it and really enjoy it for playing games and reading books,Smart Speakers
Purchased this for my nephew He loved it and cant stop playing with it,Smart Speakers
My grandson broke his Amazon fire table one day after warranty expired He was disappointed So I bought him an  version  He had a big smile,Smart Speakers
This serves every function I need in a tablet Price is right,
Its a handy little tool to have for reading eBooks,Smart Speakers
Bought this as a gift but was wrong item wanted so wasnt used,Smart Speakers
Very easy to use and navigate Perfect size to carry in my purse and still a good sized screen to watch movies,Smart Speakers
This product is very user friendly and it is very lightweight,Smart Speakers
this was great buy  can do it allfair price  great games,E-Book Readers
This was bought primarily for photos I added the  card Putting in the  card might have been a little tricky but the sales rep did it for me My wildlife photos look brilliant on the tablet Id recommend making a Geek Squad appt for about an hour after you plan to buy the tablet That way you learn how to use it before leaving the store Also I got one that had been returned but all the parts still had the plastic wrap on them That made it  less and hence the great deal in the title It may pay to ask about a return I plan to take some of the free classes offered,
I liked the volume buttons on the side of my old  Fire better than on top like this new  Thats the only reason I didnt give it a  star rating,Smart Speakers
This is an awesome tablet it is fast with great pictures,E-Book Readers
Tablet works great Nice big size good battery power No problems using it,
I am still learning all the different things I can do with the Kindle Fire So far I like it,Smart Speakers
Perfect product for senior citizen who just wants to do a little internet shopping and receive and send emails Nice size screen and easy to use Great gift for a lot less investment than an ipad or laptop,
I bought this as a gift and the recipient loves the processing speed and the fact that it has  cameras on the device,Smart Speakers
I am very happy with the kindle fire hd  it is very easy to use,Smart Speakers
I bought this for my mother for Christmas She is not the most technological advanced individual She really wanted a tablet and this one works great and is super easy to use I went to program it for her and she insisted on doing it herself She was able to no problem,
Easy to use tablet Price is pretty good My mom loves it,
Bought this tablet for a relative for Christmas who wanted access to audiobooks My only issue is that the tablet needs a wifi connection in order for the audio to work with certain apps Not a problem if you have constant access to wifi but my relative does not Nice tablet otherwise,
This device completely meets my needs for reading and accessibility,Smart Speakers
I bought this tablet for my  year old Easy to use and awesome graphics Easy for adults to manage apps and parental controls,
Great tablet for the price pointespecially if you are big Amazon userExpandable memory is a great feature,E-Book Readers
The kids more expensive tablets died twice Repair was more than the Fire brand new,Smart Speakers
I would buy another one for the priceGood product,Smart Speakers
My teenager loves to read and we purchased it for her Great purchase,
Would give  stars but THE ADDS Just as functional as my iPad,Smart Speakers
Upgraded from a standard kindle to a kindle fire Lots more features and about the same price I would definitely recommend this for anyone who wants a tablet but doesnt want to pay a lot of money,
This was a great Christmas gift for my kid This allows them to store their favorite books and play some educational games Its nice to also have an optional MicroSD card for extra storage,
works great for reading or playing games it connects to the web fast and responds very well,
Perfect for face timing with family Perfect for travel,Smart Speakers
I love this I use it daily And I love the fact that I can add a ad card for more memory,Smart Speakers
Love it and would recommend it for the young as the old,Smart Speakers
Purchased on black Friday deal for  Good buy Not iPad quality but a fraction of the price and nice for watching prime videos and normal apps Would purchase at standard price also as a fun extra tablet,
Unable to download the Instagram app which stinks,Smart Speakers
Nice size screen Very fast easy to use nice size nice screen,
I bought this for my husband who is in a nursing home to be able to listen to music He loves it And uses it every day for music and other things too,Smart Speakers
nice tabket for the money with many nice features and durable,Smart Speakers
I love the kindal because i am a reader i able to check out books from library through overdrive but if i get an alert about world event i simply go to ond of the news apps and get the latest headline Great price,
Love this tablet Super bright colors Great for gamers Cant bet this tablet for any price,E-Book Readers
The kindle fire hd is a wonderful tool as well as a device for entertainment The beauty of the kindle fire is the price I look forward to buying updated devices,Smart Speakers
My son enjoys it no complaints works great long battery life,
holds a charge better than any tablet i have ever had,
This is the rd Kindle Fire that I have purchased This one is much faster and more user friendly We just bought our  grand daughters and  grandsons a Kindle Fire with the youngest  yrs old He has it mastered already Great tablet for a good price,
Being used to an Ipad this is difficult to adust to but does the job just fine for a low price  good size to carry around without weighing down your purse Would buy again,Smart Speakers
This is an awesome product love the flexibility it has with not only book reading but other apps as well,Smart Speakers
This is my second kindle Love size of screen and it is super light Great camera,
My daughter loved it nd I love that she leaves my phone alone now,Smart Speakers
Easy to use and great quality All  of my kids have a Kindle Fire,
I bought this e reader for myself and I love it The price was great and the product is nice,
I got this for myself on black Friday I have had  Kindles before but never the Fire Love it,Smart Speakers
I love the fact that is very practical and I didnt have to spend a lot of money,Smart Speakers
Well my kids love them So thats great for me The only bad thing I can say is i cant figure out how to make it so they can download free games and not ones that cost money,
This imy rd kindle deviceI chose it becazuse it haf more memorystoeage,Smart Speakers
This is a great tablet plus you cant beat this price,E-Book Readers
I bought my fire tablet during the Christmas sale season for a great price to replace my aging iPad I am really impressed with the speed of downloads and the quality of the video I added an inexpensive SD card to download videos and shows It is great for travel,
This tablet was a gift to my daughter because shes an avid reader and anime watcher She has been nothing but excited since she opened it and there have been zero complaints,
My kindle fire HD is quite an upgrade to my old Kindle Camera is a terrific addition and the screen is so much better,Smart Speakers
Got an unbelievable deal The best part is having a library of books at my fingertips Easy and simple to set up and great when Im traveling,
I was using this for a while it was X faster then my kindle th generation yes gb of ram but the App Store made from Amazon is not the best so I downloaded the google play store to get the apps I mostly used I only use my kindle fire had  for books and reading or watching YouTube or the web Im giving the rating  stars,Smart Speakers
Ive had kindles since they first came out love it,Smart Speakers
Perfect for my elderly mom to play games and use for reading,Smart Speakers
Great for what it is The product is solid Got it as a gift for family,
Excellent resolution and speed I love the easy usability of the new fire,Smart Speakers
I got this for my sister as a gift So far so good The price was just right,
My daughter loves her tabletshe takes it with her everywhere,Smart Speakers
the kindle is all way a good product for the money the hold family have one just got me the  and love it get a Kindle and same money at the same time,Smart Speakers
Its big then the one I had I would tell my friends,Smart Speakers
I purchased this Fire Tablet as a Christmas gift for my husband He is learning to use it and so far likes it really well He hasnt downloaded any books yet but he now has an email address and will soon have a Facebook account His brothers  sisters live around the country so now he will be able to keep in contact with them,
Purchased for my granddaughter and it was a great investment,
This little  tablet is really good for reading ebooks and watching netflix,
This replaced my old original kindle fire What a great upgrade,
Thought it was to be better than what it is Mother in law can play games an Facebook on it Next time I will buy her a samsung,Smart Speakers
It was on a total of an hour and a half when the screen went completely dark Would not turn on after that The battery was fineIt just quit working all together,Smart Speakers
Bought this for my  year old Godson and he loves it He would play it for hours on end if his parents would let him He mostly plays games on it but he also uses it to watch videos and read books,Smart Speakers
The granddaughter loves it and she cant put it down,Smart Speakers
Great build qualityGood screen resolution for the moneyCan install android applications including kodi,
Like this so much bought another one for my daughter,Smart Speakers
My husband and I were looking around for a tablet for our daughter We wanted something that she could use easily and we wouldnt have to worry about what she was doing With the different profiles and parental controls available we have enjoyed our choice of this tablet,
Bought this for our granddaughter She absolutely loves it Easy for her to learn how to operate,Smart Speakers
Good tablet but not as smooth as high end tablets Its limited to Amazon so dont expect to do as much as an Android or iPad I like mine and will continue to use it I recommend using one if you can before buying,
I love it,Smart Speakers
The Unit works exactly as described A very good buy,Smart Speakers
Great tablet for price Display is clear Enjoy books on tablet,E-Book Readers
Its unfair for me to rate this product cause I have not even taken it out of the box to set it up,Smart Speakers
Kids love it Easy setup was ready with in minutes,Smart Speakers
Working Product at the price that was advertised Great,
Its nice really nice Go buy one for your grandma She will give you a real big hug,Smart Speakers
I have been using this for a bit now Its wonderful I also have another tablet but use the kindle exclusively for reading The kindle works extremely If you use amazon prime this is a no brainer,
Great speed and function for a small price Does what I needed,
I would recommend to others great playing games reading surfing the InternetCamera works very good and easy upload photos when needed,
This tablet works as expected I would recommend this tablet to anyone who needs a new tablet with great battery life,E-Book Readers
Delivers as advertised Very fast performance and the kids love it,Smart Speakers
Absolutely love the tablet My wife loves it Much more enjoyable than playing on the phone,
Great purchase Would definitely recommend it to anyone,
Now all  of my children have a kindle This one is by far the best one,Smart Speakers
Currently setting everything up on it but so far so good,Smart Speakers
Very good price good item Would purchase again This was a gift,
Purchased  of these and am real satisfied with them,Smart Speakers
Not many apps The first one was already returnedno power issue after weekI hope the second one is fine,Smart Speakers
awesome tablet wonderful upgrade from the first kindle fire,
For the money this tablet has a great display and allows you to do pretty much the same that lots of other more expensive devices are capable of,
Bought this for my daughter for Christmas She absolutely loves it She has been on it since she opened it,Smart Speakers
Grandkids each got one and they love it Step up from original Kindle,Smart Speakers
Great tablet My son really likes it to read and also to play games,
Great buy for my yr old cheap so if it ends up broken for any reason I can replace it easily,
I was always an IPad person but after having this Im fine with it Its easy to use and inexpensive,Smart Speakers
Was happy to get the toy for my son for Christmas and they wont stop playing it,Smart Speakers
Bought for my daughter she loves it Great investment for her watching movies,
Purchased two Fire tablets for my children My son loves it for reading books from library and my daughter loves listening to audio booksThey both were not sure they would like the tablet but they really love them,
Love the HD the extra inch makes a huge difference over the HD,Smart Speakers
I bought this on line as a gift The unit does not stay on and I cannot get in touch with anyone to get the unit repaired,Smart Speakers
Simple to use Great for Dad who wants to play games and check weather,
I love my tablet It is super easy and loads fast,
Bought this for a new tablet user After a quick training session she caught right on,
Perfect size for me Speaker clarity is amazing and produces a great picture,
This is a great tablet without the steep cost of an iPad I havent used it too much so far but the picture and sound is pretty good and being able to stream moviesshows is quite nice,
Perfect for summer reading and movies,Smart Speakers
Incredible value tablet,
Great tablet for the price,
love it,Smart Speakers
it seems like a lot of gadget for the money,Smart Speakers
Great value and well,E-Book Readers
Good pad for places not for IPad,Smart Speakers
I went back and bought one more,Smart Speakers
and watching movies,Smart Speakers
Love it,Smart Speakers
Great Tablet,
Excellent,Smart Speakers
worth the money,Smart Speakers
Excellent Gift,Smart Speakers
It is a great product,E-Book Readers
and performs just as good as the more expensive ones,Smart Speakers
Amazon  Fire HD    Tablet  GB  WiFi  T,
Great tablet for mom,E-Book Readers
replaced a smaller one he broke Tip add a child proff cover The migration executive experience amazing Picked up from cloud and i was good to go,Smart Speakers
Satisfied,Smart Speakers
the size is perfect not too small not too big Kid friendlyand easy to use Overall o rate it  starsno problems to list,Smart Speakers
gets the job done,Smart Speakers
Kids love it,
so it must be ok,Smart Speakers
different android chargers Nothing Worthless,Smart Speakers
Simple and nice,Smart Speakers
good quality graphics too,Smart Speakers
Very basic and cheap tablet,
faster processor and updated operating system plus a slot for external storage Great price for what you get,
Great Tablet,
Wife loves it,Smart Speakers
Good,Smart Speakers
Perfect kindle,Smart Speakers
Fire HD,Smart Speakers
great tablet,
ease of use and durability are a plus,Smart Speakers
Geart tablet,
per usual,Smart Speakers
Perfect tablet,
easy,
Great hd screen,E-Book Readers
Affordable Tablet,
with moderate internet use Glad I made this purchase,Smart Speakers
Great for child use,
Great value,E-Book Readers
Easy viewing Great color graphics,
Great Tablet,
great screen for reading,E-Book Readers
Nice Tablet For a Great Price,
Perfect for my  year old grandson,Smart Speakers
Fine tablet,
Great device,E-Book Readers
so I got her one,Smart Speakers
so I dont need to bring the same tablet back and forth It suits my need very well,
Great tablet for kids,
too,Smart Speakers
Easy to use,
Good for the money,Smart Speakers
great for catching up on your favorites show better than watching on a phone,
I was afraid it would break,Smart Speakers
fits in a small purse or bag,Smart Speakers
Space saver,Smart Speakers
Great Product,E-Book Readers
Easy to carry in purse or pocket but doesnt do anything better than the cheapest Kindle reader,Smart Speakers
Easy to handle Light weight I like that it automatically shuts off when the cover is closed,Smart Speakers
Bought for my wife to upgrade from the original Kindle that she has worn out Big step up from the original and should be good for another  years,Smart Speakers
I love the snap on cover that charges the kindle It is also very light,Smart Speakers
This is my th kindle and is easily the best one Ive ever had It is very comfortable to hold and is very compact I was surprised how small it is but has the same screen size as my other kindles It may look costly at first but remember you are getting a cover with additional battery,Smart Speakers
This is the best kindle ereader yet The size and weight make it perfect for comfortable reading You will find yourself reading more books than ever with it,Smart Speakers
I cannot yet evaluate the additional drain that this case will place on the Kindles batteryRead more,Smart Speakers
and Thats What I Got,Smart Speakers
I Wanted a Dedicated EReader,Smart Speakers
Not a longlasting product,Smart Speakers
It was everything I was looking for,Smart Speakers
Good basic tablet,
Luv this,Smart Speakers
Great tablet,
Very nice,Smart Speakers
I couldnt get the tablet to work with my WiFi so I returned it and bought a Samsung A,
Great product,E-Book Readers
geeks squad to do so Monday April  ,Smart Speakers
Nice product,
tweeting and facebook No computers can complete me My kindle takes care of all my needs  Juju,Smart Speakers
My granddaughter is happy with her Fire HD,Smart Speakers
Terrible,Smart Speakers
Nice Kindle,Smart Speakers
