reviews.text,cluster_label
This product so far has not disappointed My children love to use it and I like the ability to monitor control what content they see with ease,Smart Speakers
great for beginner or experienced person Bought as a gift and she loves it,
Ive had my Fire HD  two weeks now and I love it This tablet is a great valueWe are Prime Members and that is where this tablet SHINES I love being able to easily access all of the Prime content as well as movies you can download and watch laterThis has a  screen which has some really nice look to it its nice and crisp and very bright infact it is brighter then the ipad pro costing  base model The build on this fire is INSANELY AWESOME running at only mm thick and the smooth glossy feel on the back it is really amazing to hold its like the futuristic tab in ur hands,
This amazon fire  inch tablet is the perfect size I purchased it for my husband so that he has a bigger screen than just his phone He had gotten me one a few years ago so I knew it would be a good purchase,
I love ordering books and reading them with the reader,Smart Speakers
Not easy for elderly users cease of ads that pop up,Smart Speakers
Wanted my father to have his first tablet and this is a very good value He can watch movies and play a few games Easy enough for him to use,
Simply does everything I need Thank youAnd silk works wonders,Smart Speakers
Got it as a present and love the size of the screen,Smart Speakers
nice reader almost perfect for what i wantneed good bargain,Smart Speakers
I really like this tablet I would have given  stars but sometimes you have to push start several times after you unlock the screen and it is a little annoying,
Great video quality lots of fun apps fun for the whole family,
Love love love my kindle fire this is what my  yr old granddaughter said when I bought this for her at Christmaswe have purchased kindled in the past but this one has been the bestlove the fact that you can now use a memory card in itthat helps so much when you use it for booksgamesmusic and viedosthanks,Smart Speakers
My grandchildren are home schooled and utilize the tables for many learning apps They LOVE using them as it makes them feel so grown up The tablets are a great leaning tool and they are receiving many benefits from them,
I purchased this when my last tablet died It meets all basic needs and the price was great,
I was surprised when I learned of the capabilities of this device Now my husband has more access to his desktop and I am doing things which I couldnt on his device,Smart Speakers
I got it for my son Its user friendly and durable,Smart Speakers
If your looking for a affordable gift this is it,Smart Speakers
Works great Love the portability of books Overall great product,E-Book Readers
I am still learning all the things I can do with my new Kindle Fire It is so much better lighter in weight and easier to use than my old tablet,
Just the right size for reading books and playing some games,Smart Speakers
I love everything about this tablet The imaging is sharp and clear Its fast and light weight Love it,
Overall a nice product for traveling purposes Value for money,Smart Speakers
I bought  tablets and my family was not disappointed,Smart Speakers
Great tablet fast screen good size never gives me problem,
This is exactly what the person wanted as a gift and she enjoys using it,Smart Speakers
Does all basic functions of a tablet Hardcore users may want an iPad,
Its fast and easy to use This is my second kindle fire ,Smart Speakers
More flexibility than a Kindle and bigger screen Like it because I can surf the web and download and read books,Smart Speakers
This fire tablet has long battery life Reasonable fast,
Got this for my wife and she loves it She had the previous generation and this one is a giant keep forward,Smart Speakers
Sleek packaging easy set up and great for anyone who wants a e reader with more to offer,
My  year old Grandson loves his Kindle He had to have one after his sister got one,Smart Speakers
Easy to use As a beginner I found this pad very good Enjoy the kindle app,Smart Speakers
This Kindle does what I need it to do The camera could be better but overall I am pretty happy with my purchase,Smart Speakers
Purchased this for my daughter to do more reading It has so much more options for her if she wants,Smart Speakers
I was really hoping that this would be faster than some other inexspensive tablets Ive had I mainly use it for email though and it does the job,Smart Speakers
Bought as a Christmas gift for someone I bought iPad as well Will update when its used,Smart Speakers
Great tablet for the price It is easy to navigate,E-Book Readers
I believe that this will be very useful during my husbands recovery from foot surgery,Smart Speakers
This is something that is useful if your looking for something to take along trips,Smart Speakers
This is a wonderful device I love the extra capabilities and apps,Smart Speakers
Decent tablet Access to kindle and pretty much all your google apps,
I am very happy with this tablet The worst thing is that my steals it all the time Lol,
Easy setup and connect to WIFI Great viewing area Easy to read in bright places,
I got this fire for my friend who wants to buy kindlethis serves both Kindle and Tab very nice and very cheapworth for what i paid I highly recommend this for beginners,Smart Speakers
Really enjoyed the price value of this tablet versus ipad,
Amazing tablet with fast processor It looks great got good deal,
We got this for our  year old and this is really great for the price Works like a charm,
Was looking for a tablet that was highly portable  could run my DIRECTTV app  stream videos Other electronics I have are much older versions Salesman recommended this model to me based on personal experience I am still learning all its functions but so far it seems easy to use  is doing what it promised to do,
My wife bought this for me for my birthday I enjoy reading biographys which usually have color photos The regular Kindle make the pics black and white or theyre arent any This allows me to see the color photos I also love the night feature when Im in bed reading I no longer need a light on to read or need to hold a large book,Smart Speakers
Bought it for my  yr old granddaughter Does everything she wants it to do in a tablet,
Very easy to use tablet Lots of apps and game available,
Nice for a smaller tablet Its good for Internet surfing,
Great product for the kids gaming apps parental controls to make sure you can monitor kids and prevent unwanted app purchases,
I purchased  of these tablets for my  and  year old They were a Black Friday special for  They are perfect for the apps and games they wanted,Smart Speakers
Great product Love the Amazon ecosystem The Freetime subscription is a must,
my grandsonloves this the games and the books,Smart Speakers
Great product and Im very satisfied with it I recommend it to other people,
I purchased this tablet for my niece for Christmas and she love it,
Great tablet but apps limited comparison of other tablets,
Works as we thought it should NO PROBLEMS Good buying experience,Smart Speakers
Got this for my wife She loves the bigger screen and the better app management features that this one has over her earlier generation kindle Definitely worth it,Smart Speakers
She loves this tablet It works well unlike her bargain tablet which she tried to use previously and cost about the same She likes the sound of it also She enjoys the free games she downloaded and navigates the wev easily with it,
Didnt have some of the features I was looking for Returned it the next day May be good for others,Smart Speakers
I bought this for my daughter and she loves it Its speedy when loading books,Smart Speakers
Purchased for my wife who reads a lot and truly enjoys the amazon fire,Smart Speakers
I have enjoyed just learning how to use it Youre never too old to learn new things,Smart Speakers
This was a birthday present and it was ideal for a traveler to read ebooks on while on the rood,Smart Speakers
My teenage daughter enjoyed her three year old  Kindle for recreation but wanted a larger screen for word processing Paired this with a Bluetooth keyboard and she was thrilled,Smart Speakers
The People I purchased this for during Christmas Holiday LOVED IT,Smart Speakers
my kids enjoy the Fire HD and they love the picture quality,Smart Speakers
Bought two of these tablets for my nieces for Christmas after we had originally bought the Amazon fire  inch which had a virus after  days of purchase and was unable to work good thing we played with it prior to giving as gift do to this being said I was very surprised on how well this tablet has held up to to not so careful  years olds playing with it daily we have had no problems screen is big enough for little hands to maneuver and see on was the highlight of there Christmas and still is would definitely recommend it,
Really like the updates this product has in comparison to my first one,Smart Speakers
Functionality and ease of use are outstanding right out of the the box Super clear screen and weight is minimum and is a joy to use,Smart Speakers
This tablet is great for kids and adults who have little to no knowledge of computers It handles easily and has plenty of storage,
My god sister has been using these for yearsWhat to read more,Smart Speakers
Good tablet Wife loves it and would recommend,
Easy to use Good size Great eReader Not so expensive that I worry about my kids using it,
This Tablet was purchased for our Grandmother so she could play games and read books on,
I bought this for my wife to replace her old Kindle and she loves it Much easier to read than an iPad and updated features make it a great purchase,
Great tablet and price Ordering online easy Not happy took so long to receive though,
This is my fourth Kindleupgrading each time Mine goes everywhere with me and is used throughout the day Wouldnt be without it,Smart Speakers
We bought this for our son when he went to college He is able to upload all of his books and other documents,Smart Speakers
I purchased it for my motherinlaw and she loves it it was easier for her to use and understand,Smart Speakers
The Amazon Fire is amazing Picture clarity and sound are excellent I highly recommend this tablet Love it,
Sharp picture and easy to use And a fantastic price,
I like this is great I bought it my friend he was pleased abount,
I wanted a low cost but quality tablet and this one is a dream Easy to navigate and excellent graphics,
This a great tablet for everyone Plenty of memory for downloading Great features all around,E-Book Readers
I bought this tablet for my  year old daughter Too many advertisements I would rather pay more and not have a single ad,
This is a step up from what my son was using He said it does well and easy to use,Smart Speakers
This is a good tablet for kids who are starting off,
Awesome good size large enough for games and photos,Smart Speakers
Great gift easy to use and she loves being able to take it anywhere,
PURCHASED THIS WITH A STORE CREDIT AND LIKE IT A LOT COMPARES WELL WITH MORE EXPENSIVE TABLETSRECOMMENDED,Smart Speakers
Great gift for any age Wish I bought two I can do everything on this that I was doing on my ipad,
Great budget tablet for web browsing Also useful as an MP player and ebook reader,
I got  of these for my  yr old twins My  yr old has one but this one is better Perfect way to get them to read,Smart Speakers
This is a superb tablet for the price It doesnt come with the Android operating system It has Amazons operating system The battery last a good long time and apps run very fast I would recommend this to anyone who wants a tablet,
So very happy with the new kindle  I highly recommend this product ,Smart Speakers
It may be cheap but this is a great tablet and works awesome,E-Book Readers
My wife absolutely loves this tablet It wad an early Christmas present,
Bought for my  year old son and he absolutely loves it,Smart Speakers
I bought this as a Christmas gift for my son Very easy to use,Smart Speakers
This product is very handy on the go I can check emails and find work for my truck,Smart Speakers
Bought it on black Friday for  Value for money tablet It lags at heavy tasks and also apps are reloaded when  apps are opened at same time But at this price it is expected Go for it if budget is ,
overall this is a good tablet it is best with those who have Prime Amazon and the ability to watch Amazon video a good price for a good tablet but has limitations based on the operating system for video watching and basic use a good choice,
I love the size and portability of this Keeps me in touch and having fun,Smart Speakers
Nice tablet and couldnt beat the Black Friday price,
Im sorry I didnt buy it sooner Very easy to use Love it,Smart Speakers
Good tablet for basic needs Screens resolution is pretty good Mostly using for reading and sometimes for watching moviesshows Great feature is the possibility to use the card to expand the memory Good product for great price,
Bought as a gift for my  yr old mom to stalk her kids and grandkids on FB She mastered it in a fewminutes with minimal instruction Now I have to watch my posts,Smart Speakers
For a cheaper price this does more than my kindle love having this tablet,
Had a smaller version Love the bigger screen Use this product more than a computer,Smart Speakers
I bought  of the kindles for my grandsons They love them Had them charged and set up right away No issues at this point,Smart Speakers
Great  inches tablet with and amazing storage for apps,
Santa dropped this off for our th grader along with expanded memory he uses it for Netflix and Youtube as well as Minecraft and other Apps Why spend hundreds on something for basic kids needs Im sure this will last him a few years and is well worth the price,Smart Speakers
Got this tablet for my  year old son and he can not put it down It is so much to do So many learning games I love this product,
This is a good device for entertainment and entry level tasks I think it can do a lot for the price,Smart Speakers
also great for listening to music and also for movies,
The screen picture is crisp and bright I will use this tablet for many things,
small and powerful great adult toy for a reader,
I was hoping to use Google launcher with this tablet but it is really locked down and you cannot change the launcher or the lock screen Still cheap and fine for watching movies,
Screen is very clear and battery last a long time Very good substitute if you can afford a iPad,Smart Speakers
A Great value for the money you can save instead of a Ipad from Apple,
Fun and reliable Good quality for the money Easy to use,
I got this tablet on sale for my wife and she loves it,
So far so good with the kindle fire hd still need to play with it to see how to maximize our use,Smart Speakers
We bought this for our three daughters Got a kid proof case and added free time for a low monthly fee and couldnt be happier So much better than worrying about them breaking my phone or iPad,Smart Speakers
Bought one to replace the smaller non HD version Lot faster and picture is noticeably better Would recommend for anyone not wanting to spend the extra  or so on the big names,Smart Speakers
It was a perfect gift for my godson He loved it Definitely would recommend this product,Smart Speakers
I can do a lot of things on my Kindle I used to rely on the computer for,Smart Speakers
Excellent resource for children video streaming by Wifi using mobile hotspot with kids,Smart Speakers
best choice under  in marketamazon is the best,Smart Speakers
I really didnt expect how its going to workbut its very goodgifted to my friend,Smart Speakers
Bought this as a gift for my mom and this was to replace her original Kindle Fire Shes have had a month now and is loving and no problems with it,Smart Speakers
This was a request from our  yr old granddaugter who had always asked her older sister if she could share hers due to we bought this same tabletsize a few yrs earlier Loved the securityparental control optionsStarfall a favorite educational app were told is a must have Really enjoy PicsViber due to their in a different state Also some games on a time limit Size and resolution are perfect,Smart Speakers
Works well Easy to use Battery seems to be good Would buy again,
Ticks all the boxes I was looking for at a price I was happy to pay One caveat that I or the Best Buy and Geek Squad crews was unaware of there is a glitch in the keyboard that prevents it from working properly KindleAmazon are aware of the glitch and will download a thirdparty keyboard fix to replace the keyboard thats built in to the unit until they are able to fix the problem I made Geek Squad aware of it and they should know about it now,Smart Speakers
Amazon MayDay functionality is not available and this was unexpected Other services and functionality as expected,Smart Speakers
Perfect tablet to take anywhere you go and lighter than my IPad,
Easy to use tablet for every day use Additional apps can help increase productivity for work and daily use,
This tablet does all I need a tablet to do Reason why its my rd one,
Bought as a gift for parents who arent tech savy but were able to use it with ease,Smart Speakers
Great gift for a younger person who wants a tablet,
The fire is great The size is really nice Not to big The clarity is really good,
This inexpensive tablet does everything I want it to do I can read my books and magazines and keeps tabs on my kids and grandkids on Facebook Very easy to use and crystal clear pictures and video,
This tablet is great I loved the color and all the features it has I will be buying more for my daughters Great purchase,E-Book Readers
Its a excellent tablet for my kid she downloaded games and watch cartoons,
I was looking for a Good tablet under this deliveredgetting used to Amazon apps LOL,
Excellent ratio quality price Lightweight Good resolution and easy to use,
After long review decided to buy the Fire Tablet as a gift for a great frienday She loves it Its the perfect size and has all the features she was looking for in a tablet Happy Birthday,
Love everything about my Kindle Im a longterm Amazon Prime member,Smart Speakers
Great tablet for the price My father in law likes the easy use of the tablet,E-Book Readers
The Fire is an excellent table for many basic tasks,Smart Speakers
Not a good product short battery life i can only use for  minutes,
I enjoy to use the reader and like the idea that I can go to the internet from the Kindle,Smart Speakers
I thought that this tablet was junk but it has surpassed my expectations,
Good if you want something inexpensive and Will do the minimum very well,Smart Speakers
I found it to be very versatile and enjoyable benefiting from a touch screen,Smart Speakers
Ipad killer A fierce tablet at a convinient price,
bought as a gift she loves it all kinds of apps easy to use and even easyer with amazon prime,Smart Speakers
I bought it as the display for my Echo Turning on Voicecast routes information to the tablet with the voice reaponse ItS been exactly what I hoped it would be and the price was right,
I bought this as a gift for my son and I know he will love it he has the old kindle fire as likes it a lot,Smart Speakers
Works great and is fast Great for reading and internet use,E-Book Readers
I am loving my fire tablet and I am using it everyday at home and at work on break,
I will be ordering Amazon fire for my two granddaughters because they love Nanas so much,Smart Speakers
Really beautiful display is great for watching movies and playing games It is very powerful for the price and you can play lots of games from Amazon for free  they even remove microtransactions from lots of gamesOnly downside is you need Amazon Prime to get the most out of your tablet,
Graphics are great for the price Would highly recommend,
The pad worked as I thought but the screen wasnt as vibrant as our iPads Still a great deal for the price,
Perfect thing I needed to read books on and play my games,Smart Speakers
this tablet is perfect for surfing the internet and following social media,
For its price Amongst the others I felt this was a deal,Smart Speakers
Perfect size and very responsive I have  of them,Smart Speakers
It is very easy to use for children  We have loved having one and are hoping to buy another one for kids Christmas ,Smart Speakers
good price for the product I purchased for my middle school son,
Think this will be a great product for my parents it is a Christmas gift,
Easy to use as a tablet and easy to use as a ebook reader,
Tablet is working good for what we wanted it to do,
This tablet is a good one for everyday use It is small but it has a clear image Not sure if I really wanted one this small but its ok for now,
I like the portability of it I take it with me when I babysit my granddaughter,Smart Speakers
bought as a gift she loves it great with amazon prime,
Had the previous version of this tablet and was looking to upgrade Got this on sale and am very pleased,
My daughter love this tablet Easy to use and carry,
The salesman was very good pointed us in the right direction The tablets are perfect for our triplet grandsons,Smart Speakers
Excellent value for the price Super easy to use and set up Wonderful display I love the fact that you can add an sd card for more memory unlike the old Kindles Plus Im really impressed with the fact the Amazon has such great offers,
I love this tablet Excellent quality speakers and screen Lots of storage space Worth the money,
Bought it for my husband and he loves it This is perfect for what he wanted it for,Smart Speakers
Very fast and super easy to use Im very pleased with this purchase,Smart Speakers
Its works really well and dont have any issues at all,Smart Speakers
Tablet is good for beginners and those that like to read,
The Kindle Fire has great features for the price The video quality is asstounding,
If you want a tablet to use on a daily basis for facebook or do online purchases you couldnt ask for a better tablet,
I bought this to replace a Samsung Galaxy Tab  I absolutely love the Kindle HD  It was easy to set up and very easy to find my way around The only reason I took off  star is that I have found some apps are not available for Kindle But so far from info I have read online there are ways to resolve this issue,Smart Speakers
Just a simple kindle Doesnt have the glass back,Smart Speakers
Throughly enjoying my fire tablet Can play games and read books Am very pleased with it,
Much harder to work than an android None of the wallpaper apps I downloaded from the kindle store work on the device many of the other apps look cheap on the display other wise it is prettier and more responsive than the cheaper  tablet They make it look like an android tablet but it is not no google play Everything is just harder to work than on a regular android BUT for a tablet under  it exceeds expectations It is more responsive than other models of fire,
Kindle Fire is a dream Larger screen easy to read,Smart Speakers
I HAVE BEEN WITH AMAZON PRIME FOR  YEARS AND THIS NEW FIRE HD MAKES IT WORTH IT i WATCH MOVIES WHEN I FLY BECAUSE I CAN DOWNLOAD THEM THE BATTERY LAST FOR DAYS I USE IT EVERYDAY NOW,Smart Speakers
Improved over the HD  Things set up differently but not hard to learn Also a bit heavier than the  so reading in bed a little harder,Smart Speakers
Ive purchased a number of Kindle Fire products for family over the past several years and continue to use them Easy to use for even my youngest Grandchildren or my  year old MotherInLaw which they use as a reader and for games An overall good value,Smart Speakers
This is the fastest booting tablet I have come across The speed at which I can access sites is really amazing,
great product at a great pricei like the builtin filter which is easy on youreyesprobably the best reader under  dollars,
Very good product Super quality and the Best Buy store rep explained me about the product,
This is my third Kindle Fire and it improves each time Colors are crisper and best of all it stays charged a lot longer,Smart Speakers
Excellent Just as good as iPad with a fraction of the price,
I really love the new shape and size of the kindle HD My daughter uses it and can control it great,
Love my tablet easy to work and have no problem with down loadsand lite weight,
I love this Kindle I love the fact that you can use an SD card for more storage Great job,
The device is priced just right to give as a gift for an  year old,Smart Speakers
We have had a hard time with tablets and our  year old who has been down loading apps since she was around  years of age so far this tablet has survived everything except the constant draining of battery when used by her ,
Cant beat the value on this  stars even though it has less apps than the play store,Smart Speakers
My only disappointment is the inability to download some of the apps I use in my phone,Smart Speakers
